{
  "case_id": "v22-dev-chemistry-distillation-move-receiver",
  "attempt": 2,
  "subject": "chemistry",
  "operations": ["move", "connect", "style_cleanup"],
  "scores": {
    "core_structure": 21,
    "scientific_accuracy": 20,
    "proportion_layout": 11,
    "kice_lineart": 11,
    "restrained_gray": 3,
    "no_forbidden_marks": 10,
    "editability": 4
  },
  "hard_gates": {
    "requested_changes_complete": true,
    "locked_invariants_preserved": false,
    "severe_science_error": false,
    "forbidden_mark_count": 0,
    "unlisted_object_count": 0,
    "critical_structure_broken": false
  },
  "failure_tags": ["EDIT_OVERREACH", "SOURCE_DRIFT", "OVER_SHADE", "MODEL_VARIANCE"],
  "evidence": [
    "the targeted flat-fill correction was explicitly present",
    "smooth tonal gradients recur throughout the flask and receiver interiors",
    "receiver body and neck still differ from the source instead of moving as a rigid unit"
  ]
}
